|0|code
88|[is, not, named, in, the, list, ., And, over, every, one, of, them, the, Mother-Church, has, permanent, and, unchallengeable, control, ,, upon, every, one, of, them, Mrs., Eddy, has, set, her, irremovable, grip, ., She, holds, ,, in, perpetuity, ,, autocratic, and, indisputable, sovereignty, and, control, over, every, branch, Church, in, the, earth, ;, and, yet, says, ,, in, that, sugary, ,, naive, ,, angel-beguiling, way, of, hers, ,, that, the, Mother-Church, :, ``, shall, assume, no, official, control, of, other, churches, of, this, denomination, ., '', Whereas, in, truth, the, unmeddled-with, liberties, of, a, branch, Christian, Science, Church, are, ...]|1
89|[and, gone, millions, and, millions, of, miles, ,, through, perfect, swarms, of, angels, ,, without, ever, seeing, a, single, white, one, ,, or, hearing, a, word, I, could, understand, ., You, see, ,, America, was, occupied, a, billion, years, and, more, ,, by, Injuns, and, Aztecs, ,, and, that, sort, of, folks, ,, before, a, white, man, ever, set, his, foot, in, it, ., During, the, first, three, hundred, years, after, Columbus, 's, discovery, ,, there, was, n't, ever, more, than, one, good, lecture, audience, of, white, people, ,, all, put, together, ,, in, America, --, I, mean, the, whole, ...]|1
90|[German, ,, to, allow, my, using, it, with, impunity, ., My, collection, of, fourteen-syllable, German, words, is, still, incomplete, ., But, I, have, just, added, to, that, collection, a, jewel, --, a, veritable, jewel, ., I, found, it, in, a, telegram, from, Linz, ,, and, it, contains, ninety-five, letters, :, Personaleinkommensteuerschatzungskommissionsmitgliedsreisekostenrechnungs, erganzungsrevisionsfund, If, I, could, get, a, similar, word, engraved, upon, my, tombstone, I, should, sleep, beneath, it, in, peace, ., UNCONSCIOUS, PLAGIARISM, I, would, have, travelled, a, much, greater, distance, than, I, have, come, to, witness, the, paying, of, honors, to, Doctor, Holmes, ;, for, my, feeling, toward, him, ...]|1
91|[it, the, highest, one, that, was, ever, paid, to, me, ., To, be, the, means, of, soothing, to, sleep, a, brain, teeming, with, bugs, and, squirming, things, like, Darwin, 's, was, something, that, I, had, never, hoped, for, ,, and, now, that, he, is, dead, I, never, hope, to, be, able, to, do, it, again, ., I, must, say, that, I, have, already, begun, to, regret, that, I, left, my, gun, at, home, ., I, 've, said, so, many, times, when, a, chairman, has, distressed, me, with, just, such, compliments, that, the, next, time, such, a, thing, occurs, I, will, ...]|1
92|[little, lukewarm, on, general, practice, ,, and, writes, his, name, with, a, rubber, stamp, ., Like, my, old, Southern, ,, friend, ,, he, is, one, of, the, finest, planters, anywhere, ., Then, there, is, Jim, Ruggles, ,, the, horse-doctor, ., Ruggles, is, one, of, the, best, men, I, have, got, ., He, also, is, not, much, on, general, medicine, ,, but, he, is, a, fine, horse-doctor, ., Ferguson, does, n't, make, any, money, off, him, ., You, see, ,, the, combination, started, this, way, ., When, I, got, up, to, Redding, and, had, become, a, doctor, ,, I, looked, around, ...]|1
93|[did, not, remain, long, on, one, boat, ,, as, a, rule, ;, just, why, it, is, not, so, easy, to, understand, ., Perhaps, they, liked, the, experience, of, change, ;, perhaps, both, captain, and, pilot, liked, the, pursuit, of, the, ideal, ., In, the, light-hearted, letter, that, follows, --, written, to, a, friend, of, the, family, ,, formerly, of, Hannibal, --, we, get, something, of, the, uncertainty, of, the, pilot, 's, engagements, ., DEAR, AUNT, BETSEY, ,, --, Ma, has, not, written, you, ,, because, she, did, not, know, when, I, would, get, started, down, the, river, again, ..., .., ...]|1
94|[thousand, in, New, England, than, submit, again, to, so, much, wearing, travel, ., (, I, have, promised, to, talk, ten, nights, for, a, thousand, dollars, in, the, State, of, New, York, ,, provided, the, places, are, close, together, ., ), But, after, all, if, I, get, located, in, a, newspaper, in, a, way, to, suit, me, ,, in, the, meantime, ,, I, do, n't, want, to, lecture, at, all, next, winter, ,, and, probably, sha, n't, ., I, most, cordially, hate, the, lecture, field, ., And, after, all, ,, I, shudder, to, think, that, I, may, never, get, out, of, ...]|1
95|[caves, and, afterwards, of, echoes, ;, but, perceived, that, the, element, of, absurdity, and, impracticability, was, so, nearly, identical, as, to, amount, to, a, repetition, of, an, idea, ..., .., I, will, not, ,, and, do, not, ,, believe, that, there, is, a, possibility, of, Hayes, 's, defeat, ,, but, I, want, the, victory, to, be, sweeping, ..., .., It, seems, odd, to, find, myself, interested, in, an, election, ., I, never, was, before, ., And, I, ca, n't, seem, to, get, over, my, repugnance, to, reading, or, thinking, about, politics, ,, yet, ., But, in, truth, I, care, little, ...]|1
96|[do, ,, but, you, shall, work, if, you, want, to, ., On, the, evening, of, March, 10th, ,, I, am, going, to, read, to, the, colored, folk, in, the, African, Church, here, (, no, whites, admitted, except, such, as, I, bring, with, me, ), ,, and, a, choir, of, colored, folk, will, sing, jubilee, songs, ., I, count, on, a, good, time, ,, and, shall, hope, to, have, you, folks, there, ,, and, Livy, ., I, read, in, Twichell, 's, chapel, Friday, night, and, had, a, most, rattling, high, time, --, but, the, thing, that, went, best, of, all, was, ...]|1
97|[,, and, one, of, the, greatest, ,, wonders, of, the, world, ., To, George, Standring, ,, a, London, printer, and, publisher, ,, Clemens, wrote, :, ``, The, machine, is, finished, !, '', and, added, ,, ``, This, is, by, far, the, most, marvelous, invention, ever, contrived, by, man, ., And, it, is, not, a, thing, of, rags, and, patches, ;, it, is, made, of, massive, steel, ,, and, will, last, a, century, ., '', In, his, fever, of, enthusiasm, on, that, day, when, he, had, actually, seen, it, in, operation, ,, he, wrote, a, number, of, exuberant, letters, ., They, ...]|1
98|[Joan, ,, time, being, an, object, ,, for, some, of, the, pictures, could, be, made, over, here, cheaply, and, quickly, ,, but, would, cost, much, time, and, money, in, America, ., If, the, meeting, should, decide, to, quit, business, Jan., 4, ,, I, 'd, like, to, have, Stoker, stopped, from, paying, in, any, more, money, ,, if, Miss, Harrison, does, n't, mind, that, disagreeable, job, ., And, I, 'll, have, to, write, them, ,, too, ,, of, course, ., With, love, ,, DEAR, MR., ROGERS, ,, --, Notwithstanding, your, heart, is, ``, old, and, hard, ,, '', you, make, a, ...]|1
99|[,, and, arrived, at, this, handsome, result, :, Man, is, commanded, to, do, so-and-so, ., It, has, been, ordained, from, the, beginning, of, time, that, some, men, sha, n't, and, others, ca, n't, ., These, are, to, be, blamed, :, let, them, be, damned, ., I, enjoy, the, Colonel, very, much, ,, and, shall, enjoy, the, rest, of, him, with, an, obscene, delight, ., Joe, ,, the, whole, tribe, shout, love, to, you, and, yours, !, DEAR, JOE, ,, --, I, am, lost, in, reverence, and, admiration, !, It, is, now, twenty-four, hours, that, I, have, been, trying, to, cool, ...]|1
100|[may, be, required, for, two, years, from, the, time, of, completion, ., Will, you, please, draw, a, document, covering, these, requirements, and, have, it, ready, by, the, time, I, reach, New, York, (, April, 14th, ), ., Very, sincerely, ,]|1
